{
  "$schema": "http://json-schema.org/draft-07/schema#",
  "$id": "https://ivaylogb.github.io/agent-diagnosis-spec/v0.1/finding.schema.json",
  "title": "Finding",
  "description": "One unit of diagnosis. A conforming diagnosis is an ordered list of 2-3 Findings. additionalProperties is intentionally true: a domain tool MAY carry extra first-class fields (e.g. integration-watcher's cohort prevalence, agent-researcher's scenario metadata) without losing conformance. The eight named fields are the closed required/conditional core; everything else is a domain extension point. See SPEC.md for the reference reading; this schema is normative.",
  "type": "object",
  "additionalProperties": true,
  "required": ["id", "title", "layer", "claim", "evidence", "applyable", "verification"],
  "properties": {
    "id": {
      "type": "string",
      "pattern": "^[A-Za-z]+[0-9]+$",
      "description": "Stable identifier within the diagnosis. Convention: single-letter origin prefix + 1-based index (H1, F1, D2)."
    },
    "title": {
      "type": "string",
      "minLength": 1,
      "description": "One line naming the specific theory/pattern, with any '(Layer N)' annotation lifted into 'layer' and stripped."
    },
    "layer": {
      "type": "integer",
      "minimum": 1,
      "maximum": 4,
      "description": "Exactly one causal layer. 1=measurement instrument, 2=machine-readable interface, 3=context at decision time, 4=sequence/architecture."
    },
    "claim": {
      "type": "string",
      "minLength": 1,
      "description": "1-2 sentences stating the mechanism that produces the unwanted behavior, not that it occurs."
    },
    "evidence": {
      "type": "array",
      "minItems": 1,
      "items": { "$ref": "#/definitions/evidenceItem" },
      "description": "At least one verifiable evidence item. Tools MAY require more for their domain; the spec floor is one."
    },
    "applyable": {
      "type": "boolean",
      "description": "Whether the proposed change is expressible as a sequence of in-place structured edits. Layer does NOT determine this."
    },
    "structured_edits": {
      "type": "array",
      "minItems": 1,
      "items": { "$ref": "https://ivaylogb.github.io/agent-diagnosis-spec/v0.1/structured-edit.schema.json" },
      "description": "Required and non-empty iff applyable is true."
    },
    "reason": {
      "type": "string",
      "minLength": 1,
      "description": "Required and non-empty iff applyable is false. Why the change cannot be expressed as in-place edits."
    },
    "verification": {
      "type": "string",
      "minLength": 1,
      "description": "Falsifiable prediction: which measured quantity moves, by how much, and/or what would prove the Finding wrong."
    }
  },
  "allOf": [
    {
      "description": "D3: applyable true requires a non-empty structured_edits array.",
      "if": {
        "properties": { "applyable": { "const": true } },
        "required": ["applyable"]
      },
      "then": {
        "required": ["structured_edits"],
        "properties": {
          "structured_edits": { "type": "array", "minItems": 1 }
        }
      }
    },
    {
      "description": "D3: applyable false requires a non-empty reason string.",
      "if": {
        "properties": { "applyable": { "const": false } },
        "required": ["applyable"]
      },
      "then": {
        "required": ["reason"],
        "properties": {
          "reason": { "type": "string", "minLength": 1 }
        }
      }
    }
  ],
  "definitions": {
    "evidenceItem": {
      "type": "object",
      "required": ["type"],
      "description": "Tagged union of five evidence variants, discriminated by 'type'. Additional properties are permitted as forward-compatible extension points (e.g. confidence, notes); they are NOT part of v0.1 and MUST NOT be relied on for conformance.",
      "properties": {
        "type": {
          "type": "string",
          "enum": [
            "file_line",
            "virtual_artifact",
            "trace_reference",
            "data_reference",
            "eval_reference"
          ]
        }
      },
      "oneOf": [
        {
          "title": "file_line",
          "properties": {
            "type": { "const": "file_line" },
            "file": { "type": "string", "minLength": 1 },
            "line_start": { "type": "integer", "minimum": 1 },
            "line_end": { "type": "integer", "minimum": 1 }
          },
          "required": ["type", "file", "line_start", "line_end"]
        },
        {
          "title": "virtual_artifact",
          "properties": {
            "type": { "const": "virtual_artifact" },
            "artifact": { "type": "string", "minLength": 1 },
            "reference": { "type": "string", "minLength": 1 }
          },
          "required": ["type", "artifact", "reference"]
        },
        {
          "title": "trace_reference",
          "properties": {
            "type": { "const": "trace_reference" },
            "traces": {
              "type": "array",
              "minItems": 1,
              "items": { "type": "integer", "minimum": 1 }
            },
            "developer_id": { "type": "string", "minLength": 1 }
          },
          "required": ["type", "traces", "developer_id"]
        },
        {
          "title": "data_reference",
          "properties": {
            "type": { "const": "data_reference" },
            "schema": { "type": "string", "minLength": 1 },
            "key": { "type": "string", "minLength": 1 },
            "value": { "type": "string", "minLength": 1 }
          },
          "required": ["type", "schema", "key", "value"]
        },
        {
          "title": "eval_reference",
          "properties": {
            "type": { "const": "eval_reference" },
            "scenario_id": { "type": "string", "minLength": 1 },
            "expected": { "type": "string", "minLength": 1 },
            "observed": { "type": "string", "minLength": 1 }
          },
          "required": ["type", "scenario_id", "expected", "observed"]
        }
      ]
    }
  }
}
